{
  "schema": "rcsm-wrapper-trace/4",
  "game_id": "UCES00420",
  "plugin_version": "0.4.5-prealpha",
  "target_environment": "PPSSPP 1.19.3 / Windows 11",
  "mode": "full_module",
  "reason": "manual",
  "module_index": 3,
  "module_key": "LEVEL_03",
  "sample_unit": "vblank",
  "capture": {"start_sample": 16805, "end_sample": 58573, "installed_callsites": 33, "equivalent_profile_matches": 1, "reference_base": "0x09139D00", "runtime_base": "0x09141D00", "address_delta": 32768, "resolution_source": "module_api"},
  "unknown_hits": 0,
  "entries": [
    {"ra": "0x091482D4", "runtime_ra": "0x091502D4", "family_id": "WF-005", "installed": true, "hits": 0, "first_sample": 0, "last_sample": 0, "active_vblanks": 0, "same_vblank_hits": 0, "max_hits_per_vblank": 0, "gap_1_vblank": 0, "gap_2_vblank": 0, "gap_other_vblank": 0},
    {"ra": "0x091482F0", "runtime_ra": "0x091502F0", "family_id": "WF-005", "installed": true, "hits": 0, "first_sample": 0, "last_sample": 0, "active_vblanks": 0, "same_vblank_hits": 0, "max_hits_per_vblank": 0, "gap_1_vblank": 0, "gap_2_vblank": 0, "gap_other_vblank": 0},
    {"ra": "0x0914830C", "runtime_ra": "0x0915030C", "family_id": "WF-005", "installed": true, "hits": 0, "first_sample": 0, "last_sample": 0, "active_vblanks": 0, "same_vblank_hits": 0, "max_hits_per_vblank": 0, "gap_1_vblank": 0, "gap_2_vblank": 0, "gap_other_vblank": 0},
    {"ra": "0x09148550", "runtime_ra": "0x09150550", "family_id": "WF-013", "installed": true, "hits": 32129, "first_sample": 17578, "last_sample": 57317, "active_vblanks": 11101, "same_vblank_hits": 21028, "max_hits_per_vblank": 13, "gap_1_vblank": 11039, "gap_2_vblank": 3, "gap_other_vblank": 58},
    {"ra": "0x09148574", "runtime_ra": "0x09150574", "family_id": "WF-013", "installed": true, "hits": 32129, "first_sample": 17578, "last_sample": 57317, "active_vblanks": 11101, "same_vblank_hits": 21028, "max_hits_per_vblank": 13, "gap_1_vblank": 11039, "gap_2_vblank": 3, "gap_other_vblank": 58},
    {"ra": "0x0914AACC", "runtime_ra": "0x09152ACC", "family_id": "WF-015", "installed": true, "hits": 0, "first_sample": 0, "last_sample": 0, "active_vblanks": 0, "same_vblank_hits": 0, "max_hits_per_vblank": 0, "gap_1_vblank": 0, "gap_2_vblank": 0, "gap_other_vblank": 0},
    {"ra": "0x09162BC0", "runtime_ra": "0x0916ABC0", "family_id": "WF-014", "installed": true, "hits": 0, "first_sample": 0, "last_sample": 0, "active_vblanks": 0, "same_vblank_hits": 0, "max_hits_per_vblank": 0, "gap_1_vblank": 0, "gap_2_vblank": 0, "gap_other_vblank": 0},
    {"ra": "0x09162BE4", "runtime_ra": "0x0916ABE4", "family_id": "WF-014", "installed": true, "hits": 0, "first_sample": 0, "last_sample": 0, "active_vblanks": 0, "same_vblank_hits": 0, "max_hits_per_vblank": 0, "gap_1_vblank": 0, "gap_2_vblank": 0, "gap_other_vblank": 0},
    {"ra": "0x09162C08", "runtime_ra": "0x0916AC08", "family_id": "WF-014", "installed": true, "hits": 10474, "first_sample": 17578, "last_sample": 57032, "active_vblanks": 4244, "same_vblank_hits": 6230, "max_hits_per_vblank": 6, "gap_1_vblank": 4199, "gap_2_vblank": 1, "gap_other_vblank": 43},
    {"ra": "0x09182680", "runtime_ra": "0x0918A680", "family_id": "WF-002", "installed": true, "hits": 2585, "first_sample": 51593, "last_sample": 54386, "active_vblanks": 2585, "same_vblank_hits": 0, "max_hits_per_vblank": 1, "gap_1_vblank": 2568, "gap_2_vblank": 2, "gap_other_vblank": 14},
    {"ra": "0x09182D5C", "runtime_ra": "0x0918AD5C", "family_id": "WF-001", "installed": true, "hits": 0, "first_sample": 0, "last_sample": 0, "active_vblanks": 0, "same_vblank_hits": 0, "max_hits_per_vblank": 0, "gap_1_vblank": 0, "gap_2_vblank": 0, "gap_other_vblank": 0},
    {"ra": "0x09182D90", "runtime_ra": "0x0918AD90", "family_id": "WF-001", "installed": true, "hits": 0, "first_sample": 0, "last_sample": 0, "active_vblanks": 0, "same_vblank_hits": 0, "max_hits_per_vblank": 0, "gap_1_vblank": 0, "gap_2_vblank": 0, "gap_other_vblank": 0},
    {"ra": "0x09182F0C", "runtime_ra": "0x0918AF0C", "family_id": "WF-001", "installed": true, "hits": 0, "first_sample": 0, "last_sample": 0, "active_vblanks": 0, "same_vblank_hits": 0, "max_hits_per_vblank": 0, "gap_1_vblank": 0, "gap_2_vblank": 0, "gap_other_vblank": 0},
    {"ra": "0x09187034", "runtime_ra": "0x0918F034", "family_id": "WF-003", "installed": true, "hits": 0, "first_sample": 0, "last_sample": 0, "active_vblanks": 0, "same_vblank_hits": 0, "max_hits_per_vblank": 0, "gap_1_vblank": 0, "gap_2_vblank": 0, "gap_other_vblank": 0},
    {"ra": "0x0918EBB4", "runtime_ra": "0x09196BB4", "family_id": "WF-004", "installed": true, "hits": 0, "first_sample": 0, "last_sample": 0, "active_vblanks": 0, "same_vblank_hits": 0, "max_hits_per_vblank": 0, "gap_1_vblank": 0, "gap_2_vblank": 0, "gap_other_vblank": 0},
    {"ra": "0x092436AC", "runtime_ra": "0x0924B6AC", "family_id": "WF-008", "installed": true, "hits": 0, "first_sample": 0, "last_sample": 0, "active_vblanks": 0, "same_vblank_hits": 0, "max_hits_per_vblank": 0, "gap_1_vblank": 0, "gap_2_vblank": 0, "gap_other_vblank": 0},
    {"ra": "0x092436CC", "runtime_ra": "0x0924B6CC", "family_id": "WF-008", "installed": true, "hits": 0, "first_sample": 0, "last_sample": 0, "active_vblanks": 0, "same_vblank_hits": 0, "max_hits_per_vblank": 0, "gap_1_vblank": 0, "gap_2_vblank": 0, "gap_other_vblank": 0},
    {"ra": "0x0924392C", "runtime_ra": "0x0924B92C", "family_id": "WF-009", "installed": true, "hits": 0, "first_sample": 0, "last_sample": 0, "active_vblanks": 0, "same_vblank_hits": 0, "max_hits_per_vblank": 0, "gap_1_vblank": 0, "gap_2_vblank": 0, "gap_other_vblank": 0},
    {"ra": "0x0924394C", "runtime_ra": "0x0924B94C", "family_id": "WF-009", "installed": true, "hits": 0, "first_sample": 0, "last_sample": 0, "active_vblanks": 0, "same_vblank_hits": 0, "max_hits_per_vblank": 0, "gap_1_vblank": 0, "gap_2_vblank": 0, "gap_other_vblank": 0},
    {"ra": "0x09243B7C", "runtime_ra": "0x0924BB7C", "family_id": "WF-007", "installed": true, "hits": 0, "first_sample": 0, "last_sample": 0, "active_vblanks": 0, "same_vblank_hits": 0, "max_hits_per_vblank": 0, "gap_1_vblank": 0, "gap_2_vblank": 0, "gap_other_vblank": 0},
    {"ra": "0x09243BFC", "runtime_ra": "0x0924BBFC", "family_id": "WF-007", "installed": true, "hits": 0, "first_sample": 0, "last_sample": 0, "active_vblanks": 0, "same_vblank_hits": 0, "max_hits_per_vblank": 0, "gap_1_vblank": 0, "gap_2_vblank": 0, "gap_other_vblank": 0},
    {"ra": "0x09243C24", "runtime_ra": "0x0924BC24", "family_id": "WF-007", "installed": true, "hits": 0, "first_sample": 0, "last_sample": 0, "active_vblanks": 0, "same_vblank_hits": 0, "max_hits_per_vblank": 0, "gap_1_vblank": 0, "gap_2_vblank": 0, "gap_other_vblank": 0},
    {"ra": "0x09246608", "runtime_ra": "0x0924E608", "family_id": "WF-010", "installed": true, "hits": 0, "first_sample": 0, "last_sample": 0, "active_vblanks": 0, "same_vblank_hits": 0, "max_hits_per_vblank": 0, "gap_1_vblank": 0, "gap_2_vblank": 0, "gap_other_vblank": 0},
    {"ra": "0x092466C8", "runtime_ra": "0x0924E6C8", "family_id": "WF-010", "installed": true, "hits": 0, "first_sample": 0, "last_sample": 0, "active_vblanks": 0, "same_vblank_hits": 0, "max_hits_per_vblank": 0, "gap_1_vblank": 0, "gap_2_vblank": 0, "gap_other_vblank": 0},
    {"ra": "0x0927FEF8", "runtime_ra": "0x09287EF8", "family_id": "WF-016", "installed": true, "hits": 490, "first_sample": 26992, "last_sample": 55475, "active_vblanks": 194, "same_vblank_hits": 296, "max_hits_per_vblank": 4, "gap_1_vblank": 176, "gap_2_vblank": 0, "gap_other_vblank": 17},
    {"ra": "0x0928019C", "runtime_ra": "0x0928819C", "family_id": "WF-016", "installed": true, "hits": 495, "first_sample": 27029, "last_sample": 55523, "active_vblanks": 195, "same_vblank_hits": 300, "max_hits_per_vblank": 4, "gap_1_vblank": 177, "gap_2_vblank": 0, "gap_other_vblank": 17},
    {"ra": "0x092947F4", "runtime_ra": "0x0929C7F4", "family_id": "WF-044", "installed": true, "hits": 7325, "first_sample": 32786, "last_sample": 40121, "active_vblanks": 7325, "same_vblank_hits": 0, "max_hits_per_vblank": 1, "gap_1_vblank": 7319, "gap_2_vblank": 1, "gap_other_vblank": 4},
    {"ra": "0x092A5FDC", "runtime_ra": "0x092ADFDC", "family_id": "WF-058", "installed": true, "hits": 1943, "first_sample": 57558, "last_sample": 57741, "active_vblanks": 184, "same_vblank_hits": 1759, "max_hits_per_vblank": 12, "gap_1_vblank": 183, "gap_2_vblank": 0, "gap_other_vblank": 0},
    {"ra": "0x092AD56C", "runtime_ra": "0x092B556C", "family_id": "WF-006", "installed": true, "hits": 0, "first_sample": 0, "last_sample": 0, "active_vblanks": 0, "same_vblank_hits": 0, "max_hits_per_vblank": 0, "gap_1_vblank": 0, "gap_2_vblank": 0, "gap_other_vblank": 0},
    {"ra": "0x092BFB68", "runtime_ra": "0x092C7B68", "family_id": "WF-024", "installed": true, "hits": 0, "first_sample": 0, "last_sample": 0, "active_vblanks": 0, "same_vblank_hits": 0, "max_hits_per_vblank": 0, "gap_1_vblank": 0, "gap_2_vblank": 0, "gap_other_vblank": 0},
    {"ra": "0x092DB790", "runtime_ra": "0x092E3790", "family_id": "WF-012", "installed": true, "hits": 0, "first_sample": 0, "last_sample": 0, "active_vblanks": 0, "same_vblank_hits": 0, "max_hits_per_vblank": 0, "gap_1_vblank": 0, "gap_2_vblank": 0, "gap_other_vblank": 0},
    {"ra": "0x092DBE7C", "runtime_ra": "0x092E3E7C", "family_id": "WF-011", "installed": true, "hits": 0, "first_sample": 0, "last_sample": 0, "active_vblanks": 0, "same_vblank_hits": 0, "max_hits_per_vblank": 0, "gap_1_vblank": 0, "gap_2_vblank": 0, "gap_other_vblank": 0},
    {"ra": "0x092DBE98", "runtime_ra": "0x092E3E98", "family_id": "WF-011", "installed": true, "hits": 0, "first_sample": 0, "last_sample": 0, "active_vblanks": 0, "same_vblank_hits": 0, "max_hits_per_vblank": 0, "gap_1_vblank": 0, "gap_2_vblank": 0, "gap_other_vblank": 0}
  ]
}
